{
  "format": "repo-cartographer-curated-profile/v1",
  "profile_id": "marketleak-capabilities-v1",
  "title": "MarketLeak engineering capability map",
  "capabilities": [
    {"id":"ingestion.raw_capture","title":"Raw-first capture","description":"Immutable content-addressed raw delivery capture.","selectors":[{"kind":"capability","value":"marketleak ingestion raw store","required":true}]},
    {"id":"ingestion.normalized_storage","title":"Normalized storage","description":"Canonical normalized event persistence.","selectors":[{"kind":"capability","value":"marketleak ingestion storage","required":true},{"kind":"capability","value":"marketleak ingestion normalize","required":true}]},
    {"id":"ingestion.coverage_quality_registry","title":"Coverage, quality, and source registry","description":"Explicit coverage, quality, and approved-source contracts.","selectors":[{"kind":"capability","value":"marketleak ingestion coverage","required":true},{"kind":"capability","value":"marketleak ingestion quality","required":true},{"kind":"capability","value":"marketleak ingestion config phase15 registry","required":true}]},
    {"id":"ingestion.venue_connectors","title":"Venue connectors","description":"Bounded prediction-market connector implementations.","selectors":[{"kind":"capability","value":"marketleak ingestion connectors polymarket","required":true},{"kind":"capability","value":"marketleak ingestion connectors kalshi","required":true}]},
    {"id":"ingestion.live_market_feeds","title":"Live market feeds","description":"Static implementations for live venue feed collection.","selectors":[{"kind":"capability","value":"marketleak ingestion connectors polymarket ws live","required":true},{"kind":"capability","value":"marketleak ingestion connectors kalshi ws","required":true}]},
    {"id":"market.reference_price","title":"Documented reference prices","description":"Contract-bound underlying reference-price collection and admission.","selectors":[{"kind":"capability","value":"marketleak ingestion connectors reference price","required":true},{"kind":"capability","value":"marketleak multimodal reference price","required":true}]},
    {"id":"market.context_controls","title":"Market context controls","description":"Point-in-time market metadata and context admission.","selectors":[{"kind":"capability","value":"marketleak ingestion connectors market context","required":true},{"kind":"capability","value":"marketleak multimodal context","required":true}]},
    {"id":"market.microstructure_activity","title":"Market microstructure and activity","description":"Causal market-state and microstructure feature assembly.","selectors":[{"kind":"capability","value":"marketleak multimodal streaming","required":true},{"kind":"capability","value":"marketleak multimodal features","required":true}]},
    {"id":"market.trade_time_orderbook_join","title":"Trade-time order-book join","description":"Exact order-book state joined to each wallet action.","selectors":[{"kind":"capability","value":"marketleak trade time orderbook join","required":true}]},
    {"id":"wallet.enrollment","title":"Wallet enrollment","description":"Causal signal-to-wallet watch enrollment.","selectors":[{"kind":"capability","value":"marketleak wallet tracking","required":true}]},
    {"id":"wallet.history","title":"Wallet history","description":"Durable wallet registrations, snapshots, and follow-up states.","selectors":[{"kind":"capability","value":"marketleak wallet tracking store","required":true}]},
    {"id":"wallet.actor_features","title":"Actor fill features","description":"Wallet-level causal behavior features from observed fills.","selectors":[{"kind":"capability","value":"marketleak actors features","required":true}]},
    {"id":"wallet.cohort_ranking","title":"Wallet cohort ranking","description":"Peer-cohort construction and deterministic wallet ranking.","selectors":[{"kind":"capability","value":"marketleak actors wallet cohort","required":true},{"kind":"capability","value":"marketleak wallet cohort store","required":true}]},
    {"id":"wallet.priority_queue","title":"Wallet priority queue","description":"Operational review-priority construction.","selectors":[{"kind":"capability","value":"marketleak actors wallet priority","required":true}]},
    {"id":"wallet.case_replay","title":"Historical wallet case replay","description":"Frozen, deterministic wallet case and cohort replay.","selectors":[{"kind":"capability","value":"marketleak forensics polymarket wallet replay","required":true},{"kind":"capability","value":"marketleak forensics wallet case cohort","required":true}]},
    {"id":"wallet.onchain_context","title":"On-chain wallet context","description":"Public Polymarket/EVM and Bitcoin address-context collection without identity inference.","selectors":[{"kind":"capability","value":"marketleak agents blockchain agent","required":true},{"kind":"capability","value":"marketleak agents bitcoin agent","required":true}]},
    {"id":"wallet.graph_corroboration","title":"Deterministic graph corroboration","description":"Code-computed graph relationships and paths.","selectors":[{"kind":"capability","value":"marketleak graph repository","required":true},{"kind":"capability","value":"marketleak graph policy","required":false}]},
    {"id":"public.collection","title":"Public-information collection","description":"Bounded collection from configured public sources.","selectors":[{"kind":"capability","value":"marketleak evidence collector","required":true}]},
    {"id":"public.archive","title":"Point-in-time public archive","description":"Revisioned archive with availability-time reads.","selectors":[{"kind":"capability","value":"marketleak evidence archive","required":true}]},
    {"id":"public.matching_explanation","title":"Public matching and explanation","description":"Chronological public-evidence matching and explanation packets.","selectors":[{"kind":"capability","value":"marketleak evidence matching","required":true},{"kind":"capability","value":"marketleak evidence explanation","required":true}]},
    {"id":"public.sec_forms_345","title":"SEC Forms 3/4/5 corpus","description":"Point-in-time legal corporate-insider transaction corpus.","selectors":[{"kind":"capability","value":"marketleak evidence sec forms 3 4 5 collector","required":true}]},
    {"id":"labels.enforcement_case_corpus","title":"Enforcement case corpus","description":"Independently mapped, episode-disjoint external case corpus.","selectors":[{"kind":"capability","value":"marketleak enforcement case corpus","required":true}]},
    {"id":"multimodal.event_memory","title":"Point-in-time event memory","description":"Typed multimodal event-memory persistence.","selectors":[{"kind":"capability","value":"marketleak multimodal event store","required":true}]},
    {"id":"multimodal.feature_assembly","title":"Causal feature assembly","description":"Fixed-cutoff multimodal feature rows with missingness.","selectors":[{"kind":"capability","value":"marketleak multimodal assembly","required":true},{"kind":"capability","value":"marketleak multimodal features","required":true}]},
    {"id":"multimodal.labels","title":"Multi-axis labels","description":"Append-only human-authored mechanism, evidence, and disposition labels.","selectors":[{"kind":"capability","value":"marketleak multimodal labels","required":true}]},
    {"id":"retrieval.embeddings","title":"Local embeddings","description":"Versioned local embedding preparation and provenance.","selectors":[{"kind":"capability","value":"marketleak multimodal embeddings","required":true}]},
    {"id":"retrieval.catalog","title":"Retrieval catalog","description":"Modality-specific exact retrieval catalog.","selectors":[{"kind":"capability","value":"marketleak multimodal retrieval","required":true}]},
    {"id":"retrieval.exact_benchmark","title":"Exact retrieval benchmark","description":"Flat recall and temporal-provenance benchmark mechanics.","selectors":[{"kind":"capability","value":"benchmark flat recall at k","required":true},{"kind":"capability","value":"benchmark temporal provenance","required":true}]},
    {"id":"model.public_conditioned_action_surprise","title":"Public-conditioned action surprise","description":"Residual surprise of wallet actions given public and market state.","selectors":[{"kind":"capability","value":"marketleak public conditioned action surprise","required":true}]},
    {"id":"model.deterministic_fusion","title":"Deterministic late fusion","description":"Auditable fusion of specialist evidence.","selectors":[{"kind":"capability","value":"marketleak multimodal fusion","required":true}]},
    {"id":"model.abstention_restraint","title":"Abstention and restraint","description":"OOD, disagreement, conformal, and fail-closed controls.","selectors":[{"kind":"capability","value":"marketleak multimodal uncertainty","required":true}]},
    {"id":"model.specialist_baselines","title":"Specialist baselines","description":"Interpretable baseline candidate mechanics.","selectors":[{"kind":"capability","value":"marketleak multimodal baselines","required":true},{"kind":"capability","value":"marketleak evaluation baselines","required":true}]},
    {"id":"model.experimental_neural_shell","title":"Experimental neural shell","description":"Shared/private neural architecture code, kept separate from trained parameters.","selectors":[{"kind":"capability","value":"experimentaleventspace","required":true}]},
    {"id":"model.trained_wallet_sequence_specialists","title":"Trained wallet sequence specialists","description":"Trained short- and long-wallet sequence parameters with provenance.","selectors":[{"kind":"capability","value":"marketleak trained wallet sequence specialists","required":true}]},
    {"id":"model.trained_multimodal_fusion","title":"Trained multimodal fusion","description":"Trained, calibrated multimodal fusion parameters.","selectors":[{"kind":"capability","value":"marketleak trained multimodal fusion","required":true}]},